{
  "capabilityFamily": "audit-logging",
  "caseId": "norm-audit-logging-02",
  "caseKind": "normalization-adversarial",
  "queryInput": {
    "candidateReferences": [],
    "capabilityTerms": [
      {
        "originalTerm": "event-logging",
        "termId": "norm-audit-logging-02-term-01"
      }
    ],
    "contractVersion": "1.0.0",
    "draftConstraints": [],
    "queryInputId": "query-norm-audit-logging-02",
    "repositoryFingerprintReference": null,
    "scope": "local-pre-approval",
    "successConditions": [
      {
        "conditionId": "norm-audit-logging-02-condition-01",
        "statement": "Return bounded capability candidates or preserve the exact unresolved state."
      }
    ],
    "summary": "The controlled ambiguity must be clarified exactly."
  },
  "queryVersion": "retrieval-evaluation-query/1.0.0",
  "tags": [
    "ambiguous-primary-family",
    "intentional-ambiguity"
  ]
}
