{
  "capabilityFamily": "webhooks",
  "caseId": "norm-webhooks-01",
  "caseKind": "normalization-adversarial",
  "queryInput": {
    "candidateReferences": [],
    "capabilityTerms": [
      {
        "originalTerm": "web-hook",
        "termId": "norm-webhooks-01-term-01"
      }
    ],
    "contractVersion": "1.0.0",
    "draftConstraints": [],
    "queryInputId": "query-norm-webhooks-01",
    "repositoryFingerprintReference": null,
    "scope": "local-pre-approval",
    "successConditions": [
      {
        "conditionId": "norm-webhooks-01-condition-01",
        "statement": "Return bounded capability candidates or preserve the exact unresolved state."
      }
    ],
    "summary": "Structured alias fields own meaning."
  },
  "queryVersion": "retrieval-evaluation-query/1.0.0",
  "tags": [
    "alias-evaluation"
  ]
}
