{
  "capabilityFamily": "authorization",
  "caseId": "ret-authorization-02",
  "caseKind": "retrieval",
  "queryInput": {
    "candidateReferences": [],
    "capabilityTerms": [
      {
        "originalTerm": "authz",
        "termId": "ret-authorization-02-term-01"
      }
    ],
    "contractVersion": "1.0.0",
    "draftConstraints": [],
    "queryInputId": "query-ret-authorization-02",
    "repositoryFingerprintReference": null,
    "scope": "local-pre-approval",
    "successConditions": [
      {
        "conditionId": "ret-authorization-02-condition-01",
        "statement": "Return bounded capability candidates or preserve the exact unresolved state."
      }
    ],
    "summary": "Evaluate the structured capability query without reading gold."
  },
  "queryVersion": "retrieval-evaluation-query/1.0.0",
  "tags": [
    "active-alias",
    "family-balanced",
    "positive-multiple-relevant",
    "slot-active-alias"
  ]
}
